echo "Welcome in Employee payroll service"

UC1: create database

mysql> show databases;
+--------------------+
| Database           |
+--------------------+
| information_schema |
| mysql              |
| performance_schema |
| sys                |
+--------------------+
4 rows in set (0.33 sec)

mysql> CREATE DATABASE payroll_service;
Query OK, 1 row affected (0.27 sec)

mysql> show databases;
+--------------------+
| Database           |
+--------------------+
| information_schema |
| mysql              |
| payroll_service    |
| performance_schema |
| sys                |
+--------------------+
5 rows in set (0.04 sec)

UC2: Create Table In Employee Payroll Service database


mysql> CREATE TABLE employee_payroll_Service
    -> (id      INT UNSIGNED NOT NULL AUTO_INCREMENT,
    -> name varchar(150) not null,
    -> salary double not null,
    -> start date not null,
    -> primary key (id)
    -> );
Query OK, 0 rows affected (2.18 sec)

mysql> DESCRIBE employee_payroll_service
    -> ;
+--------+--------------+------+-----+---------+----------------+
| Field  | Type         | Null | Key | Default | Extra          |
+--------+--------------+------+-----+---------+----------------+
| id     | int unsigned | NO   | PRI | NULL    | auto_increment |
| name   | varchar(150) | NO   |     | NULL    |                |
| salary | double       | NO   |     | NULL    |                |
| start  | date         | NO   |     | NULL    |                |
+--------+--------------+------+-----+---------+----------------+
4 rows in set (0.13 sec)


UC3: Insert Data in Table

mysql> insert into employee_payroll_service (name,salary,start) values
    -> ('Bill',100000.00,'2021-01-03'),
    -> ('tersia',200000.000,'2020-03-015'),
    -> ('charlie',300000.00,'2019-06-22');
Query OK, 3 rows affected (0.33 sec)
Records: 3  Duplicates: 0  Warnings: 0


UC4:Retrive All data from table

mysql> select * from employee_payroll_service;
+----+---------+--------+------------+
| id | name    | salary | start      |
+----+---------+--------+------------+
|  1 | Bill    | 100000 | 2021-01-03 |
|  2 | tersia  | 200000 | 2020-03-15 |
|  3 | charlie | 300000 | 2019-06-22 |
+----+---------+--------+------------+
3 rows in set (0.03 sec)


UC5:Retrive salary


mysql> select salary from employee_payroll_service where name='bill';
+--------+
| salary |
+--------+
| 100000 |
+--------+
1 row in set (0.11 sec)

mysql> select * from employee_payroll_service where start between cast('2019-01-01' as date) and date(now());
+----+---------+--------+------------+
| id | name    | salary | start      |
+----+---------+--------+------------+
|  1 | Bill    | 100000 | 2021-01-03 |
|  2 | tersia  | 200000 | 2020-03-15 |
|  3 | charlie | 300000 | 2019-06-22 |
+----+---------+--------+------------+
3 rows in set (0.00 sec)

mysql> select*from employee_payroll_service
    -> where start between cast('2020-03-15' as date) and date(now());
+----+--------+--------+------------+
| id | name   | salary | start      |
+----+--------+--------+------------+
|  1 | Bill   | 100000 | 2021-01-03 |
|  2 | tersia | 200000 | 2020-03-15 |
+----+--------+--------+------------+


UC6:Alter table And Update


ysql> alter table employee_payroll_service add gender char(1) after name;
Query OK, 0 rows affected (2.66 sec)
Records: 0  Duplicates: 0  Warnings: 0

mysql> describe employee_payroll_service;
+--------+--------------+------+-----+---------+----------------+
| Field  | Type         | Null | Key | Default | Extra          |
+--------+--------------+------+-----+---------+----------------+
| id     | int unsigned | NO   | PRI | NULL    | auto_increment |
| name   | varchar(150) | NO   |     | NULL    |                |
| gender | char(1)      | YES  |     | NULL    |                |
| salary | double       | NO   |     | NULL    |                |
| start  | date         | NO   |     | NULL    |                |
+--------+--------------+------+-----+---------+----------------+
5 rows in set (0.14 sec)

mysql> update employee-payroll_service set gender ='F' where name='tersia';
ERROR 1064 (42000): You have an error in your SQL syntax; check the manual that corresponds to your MySQL server version for the right syntax to use near '-payroll_service set gender ='F' where name='tersia'' at line 1
mysql> update employee_payroll_service set gender ='F' where name='tersia';
Query OK, 1 row affected (0.18 sec)
Rows matched: 1  Changed: 1  Warnings: 0

mysql> update employee_payroll_service set gender ='M' where name = 'Bill' or name= 'charlie';
Query OK, 2 rows affected (0.12 sec)
Rows matched: 2  Changed: 2  Warnings: 0

mysql> select * from employee_payroll_service;
+----+---------+--------+--------+------------+
| id | name    | gender | salary | start      |
+----+---------+--------+--------+------------+
|  1 | Bill    | M      | 100000 | 2021-01-03 |
|  2 | tersia  | F      | 200000 | 2020-03-15 |
|  3 | charlie | M      | 300000 | 2019-06-22 |
+----+---------+--------+--------+------------+
3 rows in set (0.00 sec)

UC7:Use Function And group by clause

mysql> select avg(salary) from employee_payroll_service where gender = 'M' group by gender;
+-------------+
| avg(salary) |
+-------------+
|      200000 |
+-------------+
1 row in set (0.02 sec)

mysql> select max(salary) from employee_payroll_service group by gender;
+-------------+
| max(salary) |
+-------------+
|      200000 |
|      300000 |
+-------------+
